{
  "$schema": "https://json-schema.org/draft/2020-12/schema",
  "$id": "https://christus-rex.github.io/temple-of-maat/research/pair-authority.schema.json",
  "title": "Temple of Ma'at Canonical Pair Authority Manifest v1",
  "type": "object",
  "additionalProperties": false,
  "required": ["schema", "version", "updated", "privacy", "authorityPolicy", "sources", "methods", "currentImplementationContract", "positionalComparisonContract", "fieldProvenance", "claimBoundary", "recordEncoding", "recordColumns", "aliases", "supersession", "summary", "recordShards"],
  "properties": {
    "schema": { "const": "temple-of-maat/pair-authority-v1" },
    "version": { "const": "1.0.0" },
    "updated": { "type": "string", "pattern": "^\\d{4}-\\d{2}-\\d{2}$" },
    "privacy": { "const": "public-canonical-only" },
    "authorityPolicy": {
      "type": "object", "additionalProperties": false,
      "required": ["currentImplementationId", "authoritativeAngelSource", "authoritativePairingForCurrentImplementation", "authoritativeThirdNameMethod", "comparisonPairSet", "comparisonReunitedNameMethod", "migrationRule", "claimBoundary"],
      "properties": {
        "currentImplementationId": { "const": "temple-gematria-twin-v1" },
        "authoritativeAngelSource": { "const": "shem-master-catalogue-v1" },
        "authoritativePairingForCurrentImplementation": { "const": "gematria-twin-crossmatch-v1" },
        "authoritativeThirdNameMethod": { "const": "temple-third-name-v1" },
        "comparisonPairSet": { "const": "solomonic-positional-v1" },
        "comparisonReunitedNameMethod": { "const": "solomonic-reunited-name-v1" },
        "migrationRule": { "type": "string", "minLength": 20 },
        "claimBoundary": { "type": "string", "minLength": 20 }
      }
    },
    "sources": { "type": "array", "minItems": 3, "items": { "$ref": "#/$defs/source" } },
    "methods": { "type": "array", "minItems": 5, "items": { "$ref": "#/$defs/method" } },
    "currentImplementationContract": {
      "type": "object", "additionalProperties": false,
      "required": ["implementationId", "pairMethod", "namingMethod", "implementationStatus", "historicalStatus"],
      "properties": {
        "implementationId": { "const": "temple-gematria-twin-v1" },
        "pairMethod": { "const": "gematria-twin-crossmatch-v1" },
        "namingMethod": { "const": "temple-third-name-v1" },
        "implementationStatus": { "const": "CURRENT" },
        "historicalStatus": { "const": "modern-temple-computational-correspondence" }
      }
    },
    "positionalComparisonContract": {
      "type": "object", "additionalProperties": false,
      "required": ["pairSetId", "methodVersion", "namingMethod", "implementationStatus", "historicalStatus"],
      "properties": {
        "pairSetId": { "const": "solomonic-positional-v1" },
        "methodVersion": { "const": "solomonic-positional-four-cipher-v1" },
        "namingMethod": { "const": "solomonic-reunited-name-v1" },
        "implementationStatus": { "const": "COMPARISON_ONLY" },
        "historicalStatus": { "const": "later-occult-positional-correspondence" }
      }
    },
    "fieldProvenance": { "type": "object", "minProperties": 5, "additionalProperties": { "$ref": "#/$defs/provenanceRule" } },
    "claimBoundary": {
      "type": "object", "additionalProperties": false,
      "required": ["historicalIdentity", "metaphysicalIdentity", "pairingIsHistoricalGoetiaClaim", "numericalCorrespondenceProvesIdentity"],
      "properties": {
        "historicalIdentity": { "const": false },
        "metaphysicalIdentity": { "const": false },
        "pairingIsHistoricalGoetiaClaim": { "const": false },
        "numericalCorrespondenceProvesIdentity": { "const": false }
      }
    },
    "recordEncoding": { "const": "columnar-v1" },
    "recordColumns": {
      "type": "array", "minItems": 26, "maxItems": 26, "uniqueItems": true,
      "items": { "type": "string" }
    },
    "aliases": { "type": "object" },
    "supersession": {
      "type": "object", "additionalProperties": false,
      "required": ["supersedes", "supersededBy", "policy"],
      "properties": {
        "supersedes": { "type": "object" },
        "supersededBy": { "type": "object" },
        "policy": { "type": "string", "minLength": 20 }
      }
    },
    "summary": {
      "type": "object", "additionalProperties": false,
      "required": ["recordCount", "currentGematriaTwinPairCount", "positionalComparisonPairCount", "currentDaemonMatchesPositionalExact", "currentAngelMatchesPositionalExact", "currentThirdNameMatchesPositionalReunitedExact", "documentedRecurrenceAliases", "interpretation"],
      "properties": {
        "recordCount": { "const": 72 },
        "currentGematriaTwinPairCount": { "const": 72 },
        "positionalComparisonPairCount": { "const": 72 },
        "currentDaemonMatchesPositionalExact": { "const": 0 },
        "currentAngelMatchesPositionalExact": { "type": "integer", "minimum": 0, "maximum": 72 },
        "currentThirdNameMatchesPositionalReunitedExact": { "type": "integer", "minimum": 0, "maximum": 72 },
        "documentedRecurrenceAliases": { "type": "integer", "minimum": 0 },
        "interpretation": { "type": "string", "minLength": 20 }
      }
    },
    "recordShards": {
      "type": "array", "minItems": 8, "maxItems": 8,
      "items": {
        "type": "object", "additionalProperties": false,
        "required": ["path", "start", "end", "count"],
        "properties": {
          "path": { "type": "string", "pattern": "^research/pair-authority/pairs-[0-9]{2}-[0-9]{2}\\.v1\\.json$" },
          "start": { "type": "integer", "minimum": 1, "maximum": 72 },
          "end": { "type": "integer", "minimum": 1, "maximum": 72 },
          "count": { "const": 9 }
        }
      }
    }
  },
  "$defs": {
    "source": {
      "type": "object", "additionalProperties": false,
      "required": ["id", "title", "driveId", "role", "provenanceClass"],
      "properties": {
        "id": { "type": "string", "minLength": 1 }, "title": { "type": "string", "minLength": 1 },
        "driveId": { "type": "string", "minLength": 10 }, "role": { "type": "string", "minLength": 10 },
        "provenanceClass": { "type": "string", "minLength": 1 }
      }
    },
    "method": {
      "type": "object", "additionalProperties": false,
      "required": ["id", "sourceId", "type", "description"],
      "properties": {
        "id": { "type": "string", "minLength": 1 }, "sourceId": { "type": "string", "minLength": 1 },
        "type": { "type": "string", "minLength": 1 }, "description": { "type": "string", "minLength": 20 },
        "spellingOrNormalizationPolicy": { "type": "string" }, "oneToOneExclusive": { "type": "boolean" },
        "historicalStatus": { "type": "string" }
      }
    },
    "provenanceRule": {
      "type": "object", "additionalProperties": false,
      "required": ["sourceId", "locatorPattern"],
      "properties": { "sourceId": { "type": "string", "minLength": 1 }, "locatorPattern": { "type": "string", "minLength": 10 } }
    }
  }
}
