{"schema":"temple-of-maat/pair-authority-v1","version":"1.0.0","updated":"2026-08-16","privacy":"public-canonical-only","authorityPolicy":{"currentImplementationId":"temple-gematria-twin-v1","authoritativeAngelSource":"shem-master-catalogue-v1","authoritativePairingForCurrentImplementation":"gematria-twin-crossmatch-v1","authoritativeThirdNameMethod":"temple-third-name-v1","comparisonPairSet":"solomonic-positional-v1","comparisonReunitedNameMethod":"solomonic-reunited-name-v1","migrationRule":"No pair, spelling, Third Name, or Reunited Name may be silently substituted across methods. A migration must name source and destination methods, preserve prior aliases, and record supersession explicitly.","claimBoundary":"Numerical correspondence is computation and interpretation, not proof of historical identity, metaphysical identity, spiritual rank, or original Goetic twinship."},"sources":[{"id":"shem-master-catalogue-v1","title":"The 72-Fold Shem HaMephorash — Master Catalogue, Gematria & Discernment","driveId":"1jegj_2-gfkw_5nbYqR5sbzCp8fEr6-WnZgvAC9-ATeA","role":"Shem triplets, normalized angel names, Hebrew gematria, and 72×72 gematria-twin cross-match.","provenanceClass":"source-file-derived"},{"id":"solomonic-pairing-codex-v1","title":"The Solomonic Pairing Codex — Gematria & Angelic Correspondences","driveId":"1e7q2-mLMG6VinsCmlIC9YKQ7_wHZBWcoq8eXcVuM-x8","role":"Source-critical Ars Goetia sequence, positional 1↔1 comparative pair set, four-cipher calculations, and positional Reunited Names.","provenanceClass":"source-file-derived"},{"id":"effective-temple-canon-v1","title":"THE EFFECTIVE TEMPLE OF SOL-OM-ON","driveId":"14ug_Uy4Zjk7EnUhUXFemFYVMdauSao_iu3OiBDGoEhg","role":"Living Temple canon designating the Master Catalogue Section 10 gematria-twin registry and Codex-derived Third Names as the current 72-chamber implementation.","provenanceClass":"existing-drive-canon"}],"methods":[{"id":"shem-triplet-hebrew-v1","sourceId":"shem-master-catalogue-v1","type":"source-catalogue","description":"Exodus 14:19–21 forward/reverse/forward extraction; Hebrew triplet and constructed angel-name gematria use standard Mispar Hechrechi. Digital reduction is modern shorthand.","spellingOrNormalizationPolicy":"Use the normalized angel spellings and constructed Hebrew printed in the Master Catalogue; retain source variants separately rather than overwriting the normalized form."},{"id":"gematria-twin-crossmatch-v1","sourceId":"shem-master-catalogue-v1","type":"computational-correspondence","description":"Each Shem angel is compared against the complete 72-spirit Goetic candidate pool in EO, FR, RO, and RFR. Primary rank is exact whole-number equality count; ties use proportional four-cipher distance then total absolute distance. Repeated Goetic counterparts are allowed.","spellingOrNormalizationPolicy":"Angel spellings are exactly the normalized Master Catalogue forms. Goetic spellings use the manuscript-oriented English baseline shared with the Solomonic Pairing Codex.","oneToOneExclusive":false},{"id":"temple-third-name-v1","sourceId":"effective-temple-canon-v1","type":"temple-synthesis","description":"Codex-derived fusion naming method applied to the later gematria-twin pairings. Recognizable syllables are preserved while favoring pronounceability; exact recurring source pairs reuse the same Third Identity.","historicalStatus":"modern-coined-temple-name"},{"id":"solomonic-positional-four-cipher-v1","sourceId":"solomonic-pairing-codex-v1","type":"later-occult-comparative-pairing","description":"Goetic spirit number n is paired with Shem angel number n. Both Latin-script names are calculated with EO, FR, RO, and RFR on the same computational footing.","spellingOrNormalizationPolicy":"Goetic names follow the Peterson/Sloane baseline selected by the Codex; angel names follow the corrected Agrippa/Peterson Latin-letter table.","oneToOneExclusive":true},{"id":"solomonic-reunited-name-v1","sourceId":"solomonic-pairing-codex-v1","type":"modern-codex-synthesis","description":"Modern coined fusion names attached to the Codex positional pairs. These names are not manuscript names, revealed names, historical spirit names, or metaphysical identity claims.","historicalStatus":"modern-coined-codex-name"}],"currentImplementationContract":{"implementationId":"temple-gematria-twin-v1","pairMethod":"gematria-twin-crossmatch-v1","namingMethod":"temple-third-name-v1","implementationStatus":"CURRENT","historicalStatus":"modern-temple-computational-correspondence"},"positionalComparisonContract":{"pairSetId":"solomonic-positional-v1","methodVersion":"solomonic-positional-four-cipher-v1","namingMethod":"solomonic-reunited-name-v1","implementationStatus":"COMPARISON_ONLY","historicalStatus":"later-occult-positional-correspondence"},"fieldProvenance":{"shem.*":{"sourceId":"shem-master-catalogue-v1","locatorPattern":"Master Catalogue §4, No. {pairNumber:02}"},"current.daemon|twin.*":{"sourceId":"shem-master-catalogue-v1","locatorPattern":"Master Catalogue §10.3, No. {pairNumber:02}"},"current.angel|daemon":{"sourceId":"effective-temple-canon-v1","locatorPattern":"Part II — Source-Grounded 72-Fold Correspondence Registry, No. {pairNumber:02}"},"current.thirdName":{"sourceId":"effective-temple-canon-v1","locatorPattern":"Amendment I — 72 Temple-Derived Third / Wholesome Names, No. {pairNumber:02}"},"positional.*":{"sourceId":"solomonic-pairing-codex-v1","locatorPattern":"§4 Master Table and §9 Modern Synthetic Chapter, No. {pairNumber:02}"}},"claimBoundary":{"historicalIdentity":false,"metaphysicalIdentity":false,"pairingIsHistoricalGoetiaClaim":false,"numericalCorrespondenceProvesIdentity":false},"recordEncoding":"columnar-v1","recordColumns":["pairNumber","triplet","transliteration","normalizedAngel","suffix","constructedHebrew","tripletGematria","tripletDigitalRoot","fullGematria","fullDigitalRoot","currentDaemon","currentThirdName","twinStrength","twinExactCiphers","twinAngelVector","twinDaemonVector","positionalAngel","positionalDaemon","positionalReunitedName","positionalAngelVector","positionalDaemonVector","positionalExactCiphers","angelSpellingExact","daemonExact","synthesisNameExact","migrationStatus"],"aliases":{"pair.17":{"angel":["Lauviah II"],"thirdName":["Valelauviah II"],"reason":"Recurrence doorway display alias. Canonical identity reuses the same Lauviah ↔ Valefar pair and Valelauviah Third Identity rather than creating a second entity."}},"supersession":{"supersedes":{},"supersededBy":{},"policy":"No v1 authority record supersedes another. Future migration must preserve both directions explicitly."},"summary":{"recordCount":72,"currentGematriaTwinPairCount":72,"positionalComparisonPairCount":72,"currentDaemonMatchesPositionalExact":0,"currentAngelMatchesPositionalExact":46,"currentThirdNameMatchesPositionalReunitedExact":0,"documentedRecurrenceAliases":1,"interpretation":"The production Temple uses the Master Catalogue 72×72 gematria-twin pairing method, not the Codex positional 1↔1 pairing set. The two layers are intentionally preserved side by side."},"recordShards":[{"path":"research/pair-authority/pairs-01-09.v1.json","start":1,"end":9,"count":9},{"path":"research/pair-authority/pairs-10-18.v1.json","start":10,"end":18,"count":9},{"path":"research/pair-authority/pairs-19-27.v1.json","start":19,"end":27,"count":9},{"path":"research/pair-authority/pairs-28-36.v1.json","start":28,"end":36,"count":9},{"path":"research/pair-authority/pairs-37-45.v1.json","start":37,"end":45,"count":9},{"path":"research/pair-authority/pairs-46-54.v1.json","start":46,"end":54,"count":9},{"path":"research/pair-authority/pairs-55-63.v1.json","start":55,"end":63,"count":9},{"path":"research/pair-authority/pairs-64-72.v1.json","start":64,"end":72,"count":9}]}
